{
  "schema_version": 1,
  "competitor": "autonomous-engine",
  "task_id": "sample-fix",
  "outcome": "passed_agent",
  "elapsed_s": 1423.812,
  "head_sha": "9f1c2b3a4d5e6f708192a3b4c5d6e7f8091a2b3c",
  "model_calls": 27,
  "tokens_in": 412337,
  "tokens_out": 18922,
  "cost_usd": null,
  "versions": {
    "wrapper": "1",
    "python": "3.13.7",
    "platform": "Linux-6.8",
    "git": "git version 2.45.2",
    "autonomous_engine": "0.9.0",
    "gateway_url": "http://localhost:8082",
    "dashboard_url": "http://localhost:8080",
    "agent_definition": {"name": "full-pipeline", "provider": "anthropic", "model_id": "claude-sonnet-4-5"},
    "models": ["anthropic/claude-sonnet-4-5"]
  },
  "raw_ref": "/tmp/bench-wrappers/autonomous-engine/sample-fix/20260909T210000Z-4242/wrapper.log",
  "details": {
    "exit_code": 0,
    "work_item_id": "3a1f6b2e-1c2d-4e5f-8a9b-0c1d2e3f4a5b",
    "final_state": "passed",
    "max_tokens": 600000,
    "token_cap": {"limit": 600000, "observed": 431259, "verified": true},
    "token_accounting": "partial",
    "base_sha": "0123456789abcdef0123456789abcdef01234567",
    "checked_out_branch": "bench-autonomous-engine",
    "state_history": [{"state": "intake", "t": 0.2, "reason": ""}, {"state": "prd_approval", "t": 61.0, "reason": ""}, {"state": "passed", "t": 1420.1, "reason": "QA passed"}],
    "approvals": [{"state": "prd_approval", "endpoint": "/api/work-items/approve-prd", "t": 70.3}],
    "remote_branches": {"agent/3a1f6b2e-1c2d-4e5f-8a9b-0c1d2e3f4a5b/7d8e9f0a": "9f1c2b3a4d5e6f708192a3b4c5d6e7f8091a2b3c"},
    "merged_branches": [{"branch": "agent/3a1f6b2e-1c2d-4e5f-8a9b-0c1d2e3f4a5b/7d8e9f0a", "head": "9f1c2b3a4d5e6f708192a3b4c5d6e7f8091a2b3c"}],
    "wrapper_side_merge": false,
    "base_is_ancestor": true,
    "changed_files": ["app.py", "tests/test_subtract.py"],
    "diff_stat": " app.py               |  4 ++++\n tests/test_subtract.py | 11 +++++++++++\n 2 files changed, 15 insertions(+)",
    "diff_base": "0123456789abcdef0123456789abcdef01234567",
    "diff_head": "9f1c2b3a4d5e6f708192a3b4c5d6e7f8091a2b3c"
  }
}
